{
  "schemaVersion": "1.0.0",
  "cardId": "CX-516",
  "worldId": "lingmai-ember-red-mist",
  "approval": {
    "status": "approved",
    "approvedOn": "2026-08-03",
    "decisions": [
      "scope_six_humanoids_and_one_ink_dragon",
      "tang_song_original_xianxia_direction",
      "twelve_outfit_matrix",
      "twelve_expression_reference_assets_per_humanoid",
      "veo_lite_five_per_batch_one_per_shot_zero_retry",
      "strip_veo_audio_and_produce_voice_and_sound_independently"
    ]
  },
  "artDirection": {
    "primaryDirection": [
      "tang_grand_ceremonial",
      "song_elegant_daily",
      "original_xianxia"
    ],
    "tonalPrinciples": {
      "brightMajesty": true,
      "controlledContrast": true,
      "noGlobalGloom": true,
      "dayDuskNightContrast": true,
      "physicalMaterials": true
    },
    "prohibitions": [
      "no_dirty_gray",
      "no_unmotivated_rags",
      "no_unmotivated_wear",
      "no_modern_leather_shoes",
      "no_qing_clothing",
      "no_plastic_armor",
      "no_actor_likeness",
      "no_exact_costume_copy",
      "no_exact_set_copy",
      "no_cross_work_mashup",
      "no_global_darkness"
    ],
    "antiCopying": {
      "actorLikenessAllowed": false,
      "exactCostumeReplicationAllowed": false,
      "exactPatternReplicationAllowed": false,
      "exactSetReplicationAllowed": false,
      "directCrossWorkMashupAllowed": false
    }
  },
  "researchPolicy": {
    "officialWorkPagesOnly": true,
    "minimumWorks": 8,
    "privateReferenceRoot": "content/reference-library/private-research/cx516",
    "downloadedStillsTracked": false,
    "referenceOnly": true,
    "shipInBuild": false,
    "identityReuse": false,
    "sources": [
      {
        "workId": "work.changan_twelve_hours",
        "title": "长安十二时辰",
        "platform": "iQIYI",
        "officialPageUrl": "https://www.iq.com/wiki/zh_cn/album/%E9%95%B7%E5%AE%89%E5%8D%81%E4%BA%8C%E6%99%82%E8%BE%B0-2019-19rri0v2m5",
        "observations": ["costume", "architecture", "landscape", "lighting"],
        "abstractFindings": [
          "唐式仪制通过轴线、台阶、门阙和群体间距建立威仪，不复制具体布景",
          "服装依身份用领型、袖量、腰封和材质区分，避免全员同款飘逸长袍",
          "日光、灯火和深色室内可同框分层，阴影保留材质细节而非压成黑块"
        ],
        "referenceOnly": true,
        "shipInBuild": false,
        "identityReuse": false,
        "exactReplicationAllowed": false
      },
      {
        "workId": "work.forever_and_ever_ancient",
        "title": "周生如故",
        "platform": "iQIYI",
        "officialPageUrl": "https://www.iq.com/wiki/zh_cn/album/%E5%91%A8%E7%94%9F%E5%A6%82%E6%95%85-2021-24mppdujjp9",
        "observations": ["costume", "architecture", "lighting"],
        "abstractFindings": [
          "清雅日常以低饱和但非脏灰的织物层次、合体肩线和克制配饰呈现",
          "宫室和王府通过木、石、帘、屏风的真实厚度形成可居住空间",
          "人物情绪依眼神、下颌和呼吸变化表达，避免夸张僵硬的海报姿势"
        ],
        "referenceOnly": true,
        "shipInBuild": false,
        "identityReuse": false,
        "exactReplicationAllowed": false
      },
      {
        "workId": "work.love_between_fairy_and_devil",
        "title": "苍兰诀",
        "platform": "iQIYI",
        "officialPageUrl": "https://www.iq.com/wiki/zh_cn/album/%E8%8B%8D%E5%85%B0%E8%AF%80-2022-fxzcys7jh5",
        "observations": ["costume", "architecture", "landscape", "lighting"],
        "abstractFindings": [
          "仙界与异域可用轮廓、色温和材质体系区分，而非只靠整体变暗",
          "超大宫阙需要前中后景尺度参照、云海层次和可行走平台保持真实感",
          "幻想服装以历史结构为骨架再增加原创边缘、金属和能量纹理"
        ],
        "referenceOnly": true,
        "shipInBuild": false,
        "identityReuse": false,
        "exactReplicationAllowed": false
      },
      {
        "workId": "work.love_and_destiny",
        "title": "宸汐缘",
        "platform": "iQIYI",
        "officialPageUrl": "https://www.iq.com/album/%E5%AE%B8%E6%B1%90%E7%BC%98-2019-19rrhtj1td?lang=zh_cn",
        "observations": ["costume", "architecture", "landscape", "lighting"],
        "abstractFindings": [
          "神域宏大感来自留白、层级平台、远山与云气的纵深关系",
          "礼服宽袖和披帛需要真实重量、折痕和受风逻辑，不能像塑料薄片",
          "明亮主光配合冷色阴影可维持庄严，同时保留面部与服装纹理"
        ],
        "referenceOnly": true,
        "shipInBuild": false,
        "identityReuse": false,
        "exactReplicationAllowed": false
      },
      {
        "workId": "work.love_and_redemption",
        "title": "琉璃",
        "platform": "iQIYI",
        "officialPageUrl": "https://www.iq.com/album/%E7%90%89%E7%92%83-2020-168f5kx12d1?lang=zh_cn",
        "observations": ["costume", "architecture", "landscape", "lighting"],
        "abstractFindings": [
          "门派空间需同时具有修行秩序、生活功能和战斗移动路径",
          "青年角色的日常服可采用窄袖与轻层叠，动作时保持人体轮廓清楚",
          "法术光应照亮皮肤、布料和地面，形成共享环境光而不是悬浮贴图"
        ],
        "referenceOnly": true,
        "shipInBuild": false,
        "identityReuse": false,
        "exactReplicationAllowed": false
      },
      {
        "workId": "work.ashes_of_love",
        "title": "香蜜沉沉烬如霜",
        "platform": "iQIYI",
        "officialPageUrl": "https://www.iq.com/album/%E9%A6%99%E8%9C%9C%E6%B2%89%E6%B2%89%E7%83%AC%E5%A6%82%E9%9C%9C-2018-19rrhwgpux?lang=zh_cn",
        "observations": ["costume", "architecture", "landscape", "lighting"],
        "abstractFindings": [
          "花界、天界与战场应分别建立植物、石材、金属和天空色的主材语言",
          "轻盈仙衣仍需清晰内外层、腰线与鞋履，避免无结构纱布堆叠",
          "奇观以局部高亮、空气透视和实体前景承托，避免全屏过曝光效"
        ],
        "referenceOnly": true,
        "shipInBuild": false,
        "identityReuse": false,
        "exactReplicationAllowed": false
      },
      {
        "workId": "work.story_of_kunning_palace",
        "title": "宁安如梦",
        "platform": "iQIYI",
        "officialPageUrl": "https://www.iq.com/wiki/zh_cn/album/%E5%AE%81%E5%AE%89%E5%A6%82%E6%A2%A6-2023-yg33cwbzwl",
        "observations": ["costume", "architecture", "lighting"],
        "abstractFindings": [
          "正式场合通过规整肩线、织锦密度、冠饰尺度与空间礼序表达身份",
          "反派压迫感可由站位、构图阻隔和冷暖反差表达，不依赖破烂黑衣",
          "室内暗部需保留木纹、织物和肤色，窗光与灯光分别承担方向"
        ],
        "referenceOnly": true,
        "shipInBuild": false,
        "identityReuse": false,
        "exactReplicationAllowed": false
      },
      {
        "workId": "work.blossom",
        "title": "九重紫",
        "platform": "iQIYI",
        "officialPageUrl": "https://www.iq.com/album/%E4%B9%9D%E9%87%8D%E7%B4%AB-2024-1dskq9j7h9h?lang=zh_cn",
        "observations": ["costume", "architecture", "landscape", "lighting"],
        "abstractFindings": [
          "园宅日常需要廊、院、窗、植物和可触碰器物共同形成生活层次",
          "服装配色可鲜明但控制同屏主色数量，以材质区别主次而非靠灰尘",
          "雨夜与晨雾仍需明确可见光源、湿润反射和人物接触阴影"
        ],
        "referenceOnly": true,
        "shipInBuild": false,
        "identityReuse": false,
        "exactReplicationAllowed": false
      },
      {
        "workId": "work.till_the_end_of_the_moon",
        "title": "长月烬明",
        "platform": "Youku",
        "officialPageUrl": "https://v.youku.com/v_show/id_XNTk1NTEyNjI0NA%3D%3D.html",
        "observations": ["costume", "architecture", "landscape", "lighting"],
        "abstractFindings": [
          "神魔场景可保持宏大精致，以局部高反差与危险运动表达威胁",
          "仪式服装以明确轮廓、层级金属和织物反光建立远景识别度",
          "阵法空间必须有实体枢纽、地面反馈、照明响应和人物可交互距离"
        ],
        "referenceOnly": true,
        "shipInBuild": false,
        "identityReuse": false,
        "exactReplicationAllowed": false
      }
    ]
  },
  "characterScope": {
    "humanoidCharacterIds": [
      "character.shen_yan",
      "character.chu_mingqi",
      "character.shi_jun",
      "character.celadon_scout",
      "character.cavern_ally",
      "character.formation_spirit"
    ],
    "creatureIds": ["creature.ink_dragon"],
    "expressionReferenceSet": {
      "strategy": "reference_assets",
      "countPerHumanoid": 12,
      "emotionIds": [
        "neutral",
        "calm_warmth",
        "restrained_joy",
        "resolve",
        "vigilance",
        "suspicion",
        "concern",
        "grief",
        "anger_controlled",
        "fear_suppressed",
        "pain",
        "astonishment"
      ],
      "trainingModelPlanned": false
    }
  },
  "identityDesigns": [
    {
      "characterId": "character.shen_yan",
      "displayName": "沈砚",
      "role": "male_protagonist",
      "ageRead": "二十五岁上下",
      "silhouette": "修长稳健、肩背舒展，日常窄袖与礼服纵向层次均保持清楚人体比例",
      "posture": "重心沉稳而不僵硬，思考时略收下颌，行动前先以目光确认环境",
      "faceMotion": "情绪内敛，以眼睑、呼吸、下颌和极小嘴角变化表达警觉与决断",
      "basePalette": ["深青", "孔雀蓝", "暖象牙", "暗金"],
      "materialLanguage": ["细密绫罗", "哑光织锦", "旧金属包边", "玉石扣件"],
      "footwear": "黑青色布面皂靴，软皮底仅作结构不呈现代皮鞋亮面",
      "continuityProps": ["暗金飞刃匣"],
      "noActorLikeness": true
    },
    {
      "characterId": "character.chu_mingqi",
      "displayName": "楚明绮",
      "role": "female_protagonist",
      "ageRead": "二十四岁上下",
      "silhouette": "挺拔灵动、头身比例自然，交领内层与外披形成月环般清晰轮廓",
      "posture": "双脚受力明确，转身先由肩胯带动，战斗和对话都保持真实呼吸与重心",
      "faceMotion": "聪慧明快但不过度表演，笑意从眼神先起，戒备时嘴角收紧而非木然",
      "basePalette": ["月白", "石榴红", "鸦青", "银灰"],
      "materialLanguage": ["轻绫", "暗纹织锦", "哑光银饰", "玉髓扣件"],
      "footwear": "月白或鸦青布靴，薄底圆头并与裙摆层次一致",
      "continuityProps": ["腰侧刚性银月环"],
      "noActorLikeness": true
    },
    {
      "characterId": "character.shi_jun",
      "displayName": "石峻",
      "role": "major_villain",
      "ageRead": "三十五岁上下",
      "silhouette": "七头半以上自然比例，宽肩直身，以厚重礼袍和阵钉形成权力轮廓而非怪异巨躯",
      "posture": "站立近乎静止但身体持续呼吸，压迫感来自占据轴线与缓慢精确动作",
      "faceMotion": "愤怒控制在眼神与咬肌，几乎不大喊，偶尔的浅笑应比夸张凶相更危险",
      "basePalette": ["深绛", "苍金", "墨青", "骨白"],
      "materialLanguage": ["厚织锦", "旧鎏金", "玄色丝绦", "石质阵纹件"],
      "footwear": "深绛布面高帮靴，方圆头且无现代鞋跟和亮皮",
      "continuityProps": ["短粗方截面阵钉"],
      "noActorLikeness": true
    },
    {
      "characterId": "character.celadon_scout",
      "displayName": "青衣侦察者",
      "role": "major_supporting",
      "ageRead": "二十三岁上下",
      "silhouette": "七头半自然比例，窄袖短外层利于行动，低发辫与肩部小甲片建立辨识度",
      "posture": "膝踝松弛、前脚掌随时可转向，静止时仍有微小观察和衣料受风运动",
      "faceMotion": "目光快速扫描后定焦，低置信信息表现为短暂停顿与轻微蹙眉而非呆站",
      "basePalette": ["青瓷", "松石", "炭青", "淡玉"],
      "materialLanguage": ["斜纹细布", "哑光丝绦", "轻薄青铜", "玉质听符"],
      "footwear": "炭青布面轻靴，薄底防滑并清楚落地",
      "continuityProps": ["淡玉听风符"],